[
  {
    "schema_version": "audio-analysis-v1",
    "key": "audio_0000",
    "status": "completed",
    "stages": {
      "events": {
        "status": "completed"
      },
      "vocal": {
        "status": "not_requested"
      },
      "measurements": {
        "status": "not_requested"
      }
    },
    "events": [
      {
        "label": "Rain",
        "start_ms": 0,
        "end_ms": 1000,
        "temporal_resolution": "analysis-window",
        "confidence": 0.7
      }
    ],
    "emotions": [],
    "voice": [],
    "measurements": [],
    "quality": {
      "duration_ms": 1000,
      "warnings": []
    },
    "engines": {
      "events": {
        "model": "example/ast",
        "revision": "example-pinned"
      }
    }
  }
]
